08:52:06.949827 IP6 _gateway > ip6-allnodes: ICMP6, router advertisement, length 112
08:52:07.065819 IP6 zvs-note > ff02::16: HBH ICMP6, multicast listener report v2, 3 group record(s), length 68
08:52:07.155868 IP6 _gateway > ff02::1:ff53:bc92: ICMP6, neighbor solicitation, who has 2804:7f2:2981:8833:8ab4:a6ff:fe53:bc92, length 32
08:52:07.697261 IP6 zvs-note > ff02::16: HBH ICMP6, multicast listener report v2, 3 group record(s), length 68
08:52:08.158737 IP6 _gateway > ff02::1:ff53:bc92: ICMP6, neighbor solicitation, who has 2804:7f2:2981:8833:8ab4:a6ff:fe53:bc92, length 32
08:52:08.575770 IP _gateway > all-systems.mcast.net: igmp query v2 [max resp time 10]
08:52:08.577009 IP6 _gateway > ip6-allnodes: HBH ICMP6, multicast listener query v2 [gaddr ::], length 28
08:52:08.583547 IP6 fe80::10b3:9fff:fe8a:828d > ff02::16: HBH ICMP6, multicast listener report v2, 2 group record(s), length 48
08:52:08.585001 IP6 fe80::223:8bff:fec0:be02 > ff02::16: HBH ICMP6, multicast listener report v2, 2 group record(s), length 48
08:52:08.705870 IP6 zvs-note > ff02::16: HBH ICMP6, multicast listener report v2, 3 group record(s), length 68
08:52:08.868961 IP unknown > 224.0.0.251: igmp v2 report 224.0.0.251
08:52:09.160522 IP6 _gateway > ff02::1:ff53:bc92: ICMP6, neighbor solicitation, who has 2804:7f2:2981:8833:8ab4:a6ff:fe53:bc92, length 32
08:52:10.163654 IP6 _gateway > ff02::1:ff53:bc92: ICMP6, neighbor solicitation, who has 2804:7f2:2981:8833:8ab4:a6ff:fe53:bc92, length 32
08:52:18.587280 IP _gateway > all-systems.mcast.net: igmp query v2 [max resp time 10]
08:52:18.588908 IP6 _gateway > ip6-allnodes: HBH ICMP6, multicast listener query v2 [gaddr ::], length 28
08:52:18.596991 IP6 fe80::223:8bff:fec0:be02 > ff02::16: HBH ICMP6, multicast listener report v2, 2 group record(s), length 48
08:52:18.599107 IP6 fe80::10b3:9fff:fe8a:828d > ff02::16: HBH ICMP6, multicast listener report v2, 2 group record(s), length 48
08:52:18.656985 IP unknown > 224.0.0.251: igmp v2 report 224.0.0.251
08:52:18.738649 IP6 zvs-note > ff02::16: HBH ICMP6, multicast listener report v2, 3 group record(s), length 68
08:52:28.599687 IP _gateway > all-systems.mcast.net: igmp query v2 [max resp time 10]
08:52:28.601041 IP6 _gateway > ip6-allnodes: HBH ICMP6, multicast listener query v2 [gaddr ::], length 28
08:52:28.609001 IP6 fe80::223:8bff:fec0:be02 > ff02::16: HBH ICMP6, multicast listener report v2, 2 group record(s), length 48
08:52:28.609132 IP6 fe80::10b3:9fff:fe8a:828d > ff02::16: HBH ICMP6, multicast listener report v2, 2 group record(s), length 48
08:52:28.775139 IP6 zvs-note > ff02::16: HBH ICMP6, multicast listener report v2, 3 group record(s), length 68
08:52:28.812968 IP unknown > 224.0.0.251: igmp v2 report 224.0.0.251
08:52:37.549725 IP6 _gateway > ip6-allnodes: ICMP6, router advertisement, length 112
08:52:37.787747 IP6 zvs-note > ff02::16: HBH ICMP6, multicast listener report v2, 3 group record(s), length 68
08:52:37.847405 IP6 zvs-note > ff02::16: HBH ICMP6, multicast listener report v2, 3 group record(s), length 68
08:52:38.612141 IP _gateway > all-systems.mcast.net: igmp query v2 [max resp time 10]
08:52:38.613564 IP6 _gateway > ip6-allnodes: HBH ICMP6, multicast listener query v2 [gaddr ::], length 28
08:52:38.620996 IP6 fe80::223:8bff:fec0:be02 > ff02::16: HBH ICMP6, multicast listener report v2, 2 group record(s), length 48
08:52:38.624261 IP6 fe80::10b3:9fff:fe8a:828d > ff02::16: HBH ICMP6, multicast listener report v2, 2 group record(s), length 48
08:52:39.544958 IP unknown > 224.0.0.251: igmp v2 report 224.0.0.251
08:52:44.047812 ARP, Request who-has unknown tell zvs-note, length 46
08:52:44.047865 ARP, Reply unknown is-at 00:23:8b:c0:be:02 (oui Unknown), length 28
08:52:48.624623 IP _gateway > all-systems.mcast.net: igmp query v2 [max resp time 10]
08:52:48.626119 IP6 _gateway > ip6-allnodes: HBH ICMP6, multicast listener query v2 [gaddr ::], length 28
08:52:48.632997 IP6 fe80::223:8bff:fec0:be02 > ff02::16: HBH ICMP6, multicast listener report v2, 2 group record(s), length 48
08:52:48.634506 IP6 fe80::10b3:9fff:fe8a:828d > ff02::16: HBH ICMP6, multicast listener report v2, 2 group record(s), length 48
08:52:48.845901 IP6 zvs-note > ff02::16: HBH ICMP6, multicast listener report v2, 3 group record(s), length 68
08:52:48.980967 IP unknown > 224.0.0.251: igmp v2 report 224.0.0.251
08:52:58.636920 IP _gateway > all-systems.mcast.net: igmp query v2 [max resp time 10]
08:52:58.638413 IP6 _gateway > ip6-allnodes: HBH ICMP6, multicast listener query v2 [gaddr ::], length 28
08:52:58.644774 IP6 fe80::10b3:9fff:fe8a:828d > ff02::16: HBH ICMP6, multicast listener report v2, 2 group record(s), length 48
08:52:58.644997 IP6 fe80::223:8bff:fec0:be02 > ff02::16: HBH ICMP6, multicast listener report v2, 2 group record(s), length 48
08:52:58.880628 IP6 zvs-note > ff02::16: HBH ICMP6, multicast listener report v2, 3 group record(s), length 68
08:52:59.072964 IP unknown > 224.0.0.251: igmp v2 report 224.0.0.251
